,movie_title,movie_id,tags
1761,Money Talks,tt0119695,action comedy crime thriller blood splatter fistfight murder police prison bus heatherlocklear paulsorvino faizonlove brettratner
1762,There Will Be Blood,tt0469494,drama alcoholic alcoholism money oil turn of the century jimmeskimen paulf.tompkins kevinbreznahan paulthomasanderson
1763,The Wild Thornberrys Movie,tt0282120,adventure animation comedy family fantasy africa chimpanzee elephant safari shaman alfrewoodard flea creesummer cathymalkasian
1764,Rugrats Go Wild,tt0337711,adventure animation comedy family fantasy musical kid oxygen rugrats trapped underwater underwater elizabethdaily creesummer nancycartwright johneng
1765,Undercover Brother,tt0279493,action comedy african american cadillac disguise secret agent undercover davechappelle eddiegriffin chimcbride malcolmd.lee
1766,The Sisterhood of the Traveling Pants,tt0403508,comedy drama family romance friendship jeans pants summer vacation mikevogel americaferrera kyleschmid kenkwapis
1767,Kiss of the Dragon,tt0271027,action crime drama thriller action hero chinese forced prostitution one man army title spoken by character jetli bridgetfonda maxryan chrisnahon
1768,The House Bunny,tt0852713,comedy romance makeover party playboy playboy mansion sorority emmastone katharinemcphee beverlyd'angelo fredwolf
1769,Million Dollar Arm,tt1647668,biography drama sport baseball based on true story india sports agent training jonhamm surajsharma gregoryalanwilliams craiggillespie
1770,The Giver,tt0435651,drama romance sci-fi black and white segues into color color community dystopia infanticide jeffbridges merylstreep alexanderskarsgård phillipnoyce
1771,What a Girl Wants,tt0286788,comedy drama family romance american daughter england father politician colinfirth oliverjames kellypreston denniegordon
1772,Jeepers Creepers II,tt0301470,horror cheerleader farmer fear high school basketball nightmare nickiaycox jonathanbreck billyaaronbrown victorsalva
1773,Good Luck Chuck,tt0452625,comedy romance breasts leg spreading mini skirt sex sex in bed danecook danfogler chelansimmons markhelfrich
1774,Cradle 2 the Grave,tt0306685,action crime drama thriller camera shot from inside human body diamond evil man heist terrorism jetli tomarnold dmx andrzejbartkowiak
1775,The Hours,tt0274558,drama romance housewife lesbian novel party reading merylstreep stephendillane mirandarichardson stephendaldry
1776,She's the Man,tt0454945,comedy romance disguise roommate school soccer twin channingtatum alexandrabreckenridge lauraramsey andyfickman
1777,Mr. Bean's Holiday,tt0453451,comedy family camcorder cannes director lost passport train lilyatkinson emmadecaunes stevepemberton stevebendelack
1778,Anacondas: The Hunt for the Blood Orchid,tt0366174,action adventure horror thriller anaconda blood borneo flower orchid nicholasgonzalez sallirichardson-whitfield johnnymessner dwighth.little
1779,Blood Ties,tt1747958,crime drama thriller 1970s flashback love money murder milakunis lilitaylor billycrudup guillaumecanet
1780,August Rush,tt0426931,drama music baby cellist genius prodigy rhapsody robinwilliams aaronstaton marianseldes kirstensheridan
1781,Elizabeth,tt0127536,biography drama history 16th century british royal family catholic queen queen elizabeth i fannyardant johngielgud ericcantona shekharkapur
1782,Bride of Chucky,tt0144120,comedy fantasy horror romance blood doll gore murder serial killer alexisarquette parkbench vincecorazza ronnyyu
1783,Tora! Tora! Tora!,tt0066473,action drama history war attack hawaii navy pearl harbor u.s. navy josephcotten richardanderson jameswhitmore richardfleischer
1784,Spice World,tt0120185,comedy family music bus concert live concert pop group spice girl jasonflemyng richardbriers victoriabeckham bobspiers
1785,Dance Flick,tt1153706,action comedy music african american dance overalls parody rap damonwayansjr. essenceatkins chriselliott damiendantewayans
1786,The Shawshank Redemption,tt0111161,crime drama escape from prison first person narration prison prison cell search wrongful imprisonment morganfreeman jeffreydemunn bobgunton frankdarabont
1787,Crocodile Dundee in Los Angeles,tt0231402,adventure comedy crime boat crocodile garbage can knife paramount pictures jereburns paulhogan lindakozlowski simonwincer
1788,Kingpin,tt0116778,comedy sport amish bowling on the road rubber hand tournament billmurray linshaye richardtyson bobbyfarrelly
1789,The Gambler,tt2039393,crime drama thriller dog gambler gambling gangster professor georgekennedy cjonsaulsberry griffincleveland rupertwyatt
1790,August: Osage County,tt1322269,drama based on play incestuous relationship pedophilia secret teenage daughter benedictcumberbatch merylstreep juliaroberts johnwells
1791,A Lot Like Love,tt0391304,comedy drama romance flight hasselblad camera los angeles california love medium format camera aimeegarcia tyronegiordano jamesread nigelcole
1792,Eddie the Eagle,tt1083452,biography comedy drama sport 1988 winter olympics coach ski jumper winter winter olympics hughjackman taronegerton timmcinnerny dexterfletcher
1793,He Got Game,tt0124718,drama sport basketball basketball player female nudity porn actor in mainstream movie prison denzelwashington millajovovich rosariodawson spikelee
1794,Don Juan DeMarco,tt0112883,comedy drama romance don juan mental institution patient psychiatrist retirement johnnydepp marlonbrando fayedunaway jeremyleven
1795,The Losers,tt0480255,action crime drama mystery thriller hacking hijacking martial arts revenge special forces chrisevans jasonpatric óscarjaenada sylvainwhite
1796,Don't Be Afraid of the Dark,tt1270761,fantasy horror thriller basement creature disappearance interior designer mansion baileemadison alandale jackthompson troynixey
1797,War,tt0499556,action crime thriller assassin betrayal fbi fbi agent yakuza jasonstatham jetli nadinevelazquez philipg.atwell
1798,Punch-Drunk Love,tt0272338,comedy drama romance thriller harmonium love phone sex pudding sister adamsandler emilywatson donmcmanus paulthomasanderson
1799,EuroTrip,tt0356150,comedy female frontal nudity male frontal nudity nudist nudity public nudity mattdamon scottmechlowicz jacobpitts jeffschaffer
1800,Half Past Dead,tt0297162,action crime thriller alcatraz fbi gold prison undercover claudiachristian niapeeples tonyplana donmichaelpaul
1801,Unaccompanied Minors,tt0488658,adventure comedy family romance airport black comedy blizzard christmas pennsylvania tylerjameswilliams robriggle b.j.novak paulfeig
1802,"Bright Lights, Big City",tt0094799,drama estranged wife fashion show magazine new york city writer diannewiest phoebecates swoosiekurtz jamesbridges
1803,The Adventures of Pinocchio,tt0115472,adventure family fantasy musical based on novel human becoming an animal slow motion transformation young boy martinlandau udokier bebeneuwirth stevebarron
1804,The Box,tt0362478,drama fantasy mystery thriller alien library moral dilemma nosebleed supernatural power franklangella gillianjacobs celiaweston richardkelly
1805,The Ruins,tt0963794,horror bow and arrow group of friends horse rifle ruins lauraramsey jonathantucker sergiocalderón cartersmith
1806,The Next Best Thing,tt0156841,comedy drama romance best friend cartoon on tv custody battle gay gay friend markvalley ruperteverett illeanadouglas johnschlesinger
1807,My Soul to Take,tt0872230,horror mystery thriller evil killer murder psychopath serial killer frankgrillo emilymeade zenagrey wescraven
1808,The Girl Next Door,tt0265208,comedy drama romance forced to strip male rear nudity porn actress scantily clad female teenager chrismarquette timothybottoms jacobyoung lukegreenfield
1809,Maximum Risk,tt0117011,action crime mystery romance thriller fbi fbi agent mafia russian mafia twin natashahenstridge zachgrenier paulben-victor ringolam
1810,Stealing Harvard,tt0265808,comedy crime black humor crying during sex harvard humor man with glasses martinstarr meganmullally chrispenn brucemcculloch
1811,Legend,tt3569230,biography crime drama history thriller 1960s based on a true story gangster identical twins murder tomhardy paulanderson tarafitzgerald brianhelgeland
1812,Shark Night 3D,tt1633356,horror thriller lake louisiana redneck shark vacation chriszylka joeldavidmoore katharinemcphee davidr.ellis
1813,Angela's Ashes,tt0145653,drama drink ira irish limerick prejudice emilywatson devonmurray paulinemclynn alanparker
1814,Draft Day,tt2223990,drama sport cleveland browns head coach linebacker nfl team owner jennifergarner chimcbride patrickst.esprit ivanreitman
1815,The Conspirator,tt0968264,crime drama history john wilkes booth lawyer lincoln assassination trial truth robinwright tomwilkinson stephenroot robertredford
1816,Lords of Dogtown,tt0355702,biography drama sport 1970s skateboarder skateboarding surf swimming pool heathledger michaelangarano rebeccademornay catherinehardwicke
1817,The 33,tt2006295,biography drama history disaster movie mine minister president trapped in a mine marcotreviño jamesbrolin jacobvargas patriciariggen
1818,Big Trouble in Little China,tt0090728,action adventure comedy fantasy 1980s airport cb radio truck truck driver victorwong kateburton peterkwong johncarpenter
1819,Warrior,tt1291584,drama sport alcoholic mixed martial arts return home tournament underdog tomhardy frankgrillo kevindunn gavino'connor
1820,Michael Collins,tt0117039,biography drama thriller war ireland irish irish civil war irish free state sinn fein alanrickman liamneeson juliaroberts neiljordan
1821,Gettysburg,tt0107007,drama history war american civil war battle blood splatter civil war irish american tomberenger williammorgansheppard jamespatrickstuart ronmaxwell
1822,Stop-Loss,tt0489281,drama war friendship honor iraq war soldier texas josephgordon-levitt channingtatum abbiecornish kimberlypeirce
1823,Abandon,tt0267248,drama music mystery romance thriller college detective disappearance police detective thesis charliehunnam zooeydeschanel tonygoldwyn stephengaghan
1824,Brokedown Palace,tt0120620,drama mystery thriller bangkok friend lawyer smuggling thailand johndoe tomamandes daniellapaine jonathankaplan
1825,The Possession,tt0431021,horror thriller basketball coach box jewish rabbi yard sale kyrasedgwick madisondavenport natashacalis olebornedal
1826,Mrs. Winterbourne,tt0117104,comedy drama romance love train train wreck twin brother two word title brendanfraser janekrakowski cathryndeprume richardbenjamin
1827,Straw Dogs,tt0999913,action drama thriller gang rape panties pulled down rape rape victim sexual humiliation alexanderskarsgård lazalonso rhyscoiro rodlurie
1828,The Hoax,tt0462338,comedy drama book fabrication fake hoax manuscript hopedavis christopherevanwelch jamesbiberi lassehallström
1829,Stone Cold,tt0102984,action crime drama thriller biker biker gang fbi mississippi undercover brianbosworth sammcmurray richardgant craigr.baxley
1830,The Road,tt0898367,adventure drama apocalypse boy food pistol survival viggomortensen charlizetheron robertduvall johnhillcoat
1831,Underclassman,tt0373416,action comedy crime drama thriller police private school shootout undercover wigger cheechmarin nickcannon kayleedefer marcossiega
1832,Say It Isn't So,tt0239949,comedy romance bestiality brother sister incest fisting hit on the head with a pipe wedding eddiecibrian chrisklein jackplotnick j.b.rogers
1833,The World's Fastest Indian,tt0412080,biography drama sport mortgage motorcycle speed trailer utah anthonyhopkins antonystarr craighall rogerdonaldson
1834,Tank Girl,tt0114614,action comedy sci-fi 2030s 21st century desert jet tank naomiwatts loripetty jeffkober racheltalalay
1835,King's Ransom,tt0388183,comedy crime hit in the crotch kidnapping nail gun police release from prison donaldfaison lorettadevine reginahall jeffreyw.byrd
1836,Blindness,tt0861689,drama mystery sci-fi thriller blindness epidemic hospital pubic hair quarantine donmckellar joepingue yûsukeiseya fernandomeirelles
1837,BloodRayne,tt0383222,action adventure fantasy horror escape half human king vampire vampire hunter meatloaf udokier michaelparé uweboll
1838,Where the Truth Lies,tt0373450,crime drama mystery thriller breasts death female rear nudity lesbian cunnilingus rear entry sex colinfirth alisonlohman rachelblanchard atomegoyan
1839,Without Limits,tt0119934,biography drama sport car crash coach death oregon university of oregon billyburke monicapotter billycrudup roberttowne
1840,Me and Orson Welles,tt1175506,drama high school mercury theatre opening night school theatre zoekazan aidanmcardle jamestupper richardlinklater
1841,The Best Offer,tt1924396,crime drama mystery romance antique art heiress older man younger woman relationship plot twist jimsturgess seanbuchanan liyakebede giuseppetornatore
1842,Bad Lieutenant: Port of Call New Orleans,tt1095217,crime drama drugs flood hallucination lieutenant murder investigation nicolascage sheawhigham shawnhatosy wernerherzog
1843,Little White Lies,tt1440232,comedy drama friend restaurant secret unrequited love vacation françoiscluzet benoîtmagimel gilleslellouche guillaumecanet
1844,Love Ranch,tt1125929,comedy drama romance sport argentine brothel cancer female full frontal nudity fight scouttaylor-compton bailing gilbirmingham taylorhackford
1845,The Counselor,tt2193215,crime drama thriller cunnilingus drug trafficking lawyer no panties shootout michaelfassbender bradpitt goranvisnjic ridleyscott
1846,Dangerous Liaisons,tt0094947,drama romance catholic corruption emotional abuse france seduction keanureeves petercapaldi swoosiekurtz stephenfrears
1847,On the Road,tt0337692,adventure drama benzedrine cactus drugs poem year 1949 kristenstewart viggomortensen kirstendunst waltersalles
1848,Star Trek IV: The Voyage Home,tt0092007,adventure comedy sci-fi alien probe humpback whales probe time travel whale leonardnimoy nichellenichols walterkoenig leonardnimoy
1849,Rocky Balboa,tt0479143,drama sport boxing fight heavyweight champion restaurant retired boxer sylvesterstallone burtyoung miketyson sylvesterstallone
1850,Scream 2,tt0120082,horror mystery college ghostface killer killing spree murder omarepps jadapinkettsmith kevinwilliamson wescraven
1851,Jane Got a Gun,tt2140037,action drama western brothel death of husband ex lover haunted by the past redemption natalieportman noahemmerich boydholbrook gavino'connor
1852,Think Like a Man Too,tt2239832,comedy romance african american imperative in title las vegas nevada nevada wedding romanymalco reginahall davidwalton timstory
1853,The Whole Nine Yards,tt0190138,comedy crime adultery black humor dentist hitman sex in bed brucewillis matthewperry natashahenstridge jonathanlynn
1854,Footloose,tt0087277,drama music romance church cowboy boots dancing high school dance teenager diannewiest chrispenn lorisinger herbertross
1855,Old School,tt0302886,comedy college fraternity friend house party willferrell leahremini patrickfischler toddphillips
1856,The Fisher King,tt0101889,comedy drama fantasy friendship holy grail massacre redemption video store jeffbridges davidhydepierce harryshearer terrygilliam
1857,I Still Know What You Did Last Summer,tt0130018,horror mystery bahamas fisherman hook island roommate musewatson mekhiphifer billcobbs dannycannon
1858,Return to Me,tt0122459,comedy drama romance heart italian restaurant restaurant transplant waitress minniedriver jimbelushi bonniehunt bonniehunt
1859,Zack and Miri Make a Porno,tt1007028,comedy romance actor friend male frontal nudity male full frontal nudity penis gerrybednob jeffanderson jenniferschwalbachsmith kevinsmith
1860,Nurse Betty,tt0171580,comedy crime drama hospital kansas city obsession salesman soap opera morganfreeman pruitttaylorvince kathleenwilhoite neillabute
1861,The Men Who Stare at Goats,tt1234548,comedy war first person narration general hampster reference to loch ness monster reporter kevinspacey jeffbridges stephenroot grantheslov
1862,Double Take,tt0238948,action comedy crime thriller cia cia agent fbi mexico train danielroebuck eddiegriffin garcellebeauvais georgegallo
1863,"Girl, Interrupted",tt0172493,biography drama 1960s father daughter incest mental hospital suicide suicide attempt angelinajoliepitt cleaduvall vanessaredgrave jamesmangold
1864,Win a Date with Tad Hamilton!,tt0335559,comedy romance best friend contest date small town west virginia tophergrace garycole nathanlane robertluketic
1865,Muppets from Space,tt0158811,adventure comedy family fantasy music sci-fi alien breakfast escape rat ufo joshcharles f.murrayabraham davidarquette timhill
1866,The Wiz,tt0078504,adventure family fantasy music musical melancholy new york city sadness teacher wizard lenahorne dianaross theresamerritt sidneylumet
1867,Ready to Rumble,tt0217756,comedy sport gay subtext homoerotic fight homoeroticism homosexual subtext wcw wrestling oliverplatt ellenalbertinidow martinlandau brianrobbins
1868,Play It to the Bone,tt0196857,comedy drama sport boxing movie friendship highway travel male rear nudity road movie williegarson robertwagner lolitadavidovich ronshelton
1869,I Don't Know How She Does It,tt1742650,comedy romance black comedy delivery boy dinner gym punishment oliviamunn busyphilipps jessicaszohr douglasmcgrath
1870,Piranha 3D,tt0464154,comedy horror bloody water boat party piranha spring break adamscott kellybrook jessicaszohr alexandreaja
1871,Beyond the Sea,tt0363473,biography drama music musical bobby darin career love marriage sandra dee kevinspacey bobhoskins brendablethyn kevinspacey
1872,The Princess and the Cobbler,tt0112389,action adventure animation comedy fantasy cobbler desert gold princess thief donaldpleasence kennethwilliams cliverevill richardwilliams
1873,The Bridge of San Luis Rey,tt0356443,drama romance bridge friar inquisition peru rope bridge robertdeniro f.murrayabraham geraldinechaplin marymcguckian
1874,Faster,tt1433108,action crime drama thriller gun prison reference to god reference to jesus christ vengeance dwaynejohnson tomberenger mikeepps georgetillmanjr.
1875,Howl's Moving Castle,tt0347149,adventure animation family fantasy anime castle demon steampunk witch christianbale blythedanner jeansimmons hayaomiyazaki
1876,Zombieland,tt1156398,adventure comedy horror sci-fi amusement park on the road zombie zombie apocalypse zombie spoof emmastone billmurray derekgraf rubenfleischer
1877,The Waterboy,tt0120484,comedy sport coach college college football domineering mother football adamsandler clinthoward peterdante frankcoraci
1878,Star Wars: Episode V - The Empire Strikes Back,tt0080684,action adventure fantasy sci-fi duel famous twist rebel rescue snowy landscape harrisonford kennybaker anthonydaniels irvinkershner
1879,Bad Boys,tt0112442,action comedy crime drama thriller drugs heroin murder police witness willsmith tchékykaryo theresarandle michaelbay
1880,The Naked Gun 2½: The Smell of Fear,tt0102510,comedy crime american president evil industrialist ex girlfriend political leader president georgekennedy priscillapresley o.j.simpson davidzucker
1881,Final Destination,tt0195714,horror thriller dead teenager death explosion premonition teenager danielroebuck brendanfehr kerrsmith jameswong
1882,The Ides of March,tt1124035,drama governor intern manager ohio politics ryangosling philipseymourhoffman jenniferehle georgeclooney
1883,Pitch Black,tt0134847,horror sci-fi captain darkness eclipse space survival vindiesel radhamitchell colehauser davidtwohy
1884,Someone Like You...,tt0244970,comedy romance apartment girl in panties roommate thong panties upskirt hughjackman ellenbarkin catherinedent tonygoldwyn
1885,Her,tt1798709,drama romance sci-fi divorce female frontal nudity future loneliness operating system scarlettjohansson brianjohnson mattletscher spikejonze
1886,Joy Ride,tt0206314,mystery thriller embarrassing male nudity embarrassing nudity male nudity truck truck driver paulwalker jessicabowman dellyount johndahl
1887,The Adventurer: The Curse of the Midas Box,tt1376213,adventure family fantasy based on novel drowning hanging from a flagpole hanging from a rope magic ioangruffudd keeleyhawes oliverstark jonathannewman
1888,Anywhere But Here,tt0149691,comedy drama family relationships female protagonist nubile woman policeman teenager natalieportman evaamurrimartino shawnhatosy waynewang
1889,The Crew,tt0198386,comedy crime beach drug lord drugs hotel stripper seymourcassel danhedaya lainiekazan michaeldinner
1890,Haywire,tt1506999,action thriller die hard scenario one woman army rescue soldier super soldier channingtatum michaelfassbender michaelangarano stevensoderbergh
1891,Jaws: The Revenge,tt0093300,adventure horror thriller banana boat boat christmas sea shark judithbarsi mariovanpeebles lynnwhitfield josephsargent
1892,Marvin's Room,tt0116999,drama house leukemia mental institution nursing home transplant leonardodicaprio robertdeniro merylstreep jerryzaks
1893,The Longshots,tt1091751,biography comedy drama family sport absent father american football based on true story middle school tashasmith dashmihok garrettmorris freddurst
1894,The End of the Affair,tt0172396,drama romance breasts jealousy obsession sex scene spiritual stephenrea ianhart jamesbolam neiljordan
1895,Harley Davidson and the Marlboro Man,tt0102005,action crime drama thriller western bar biker cowboy drugs marlboro vanessawilliams tiacarrere donjohnson simonwincer
1896,Coco Before Chanel,tt1035736,biography drama baron fashion hat nickname orphanage alessandronivola benoîtpoelvoorde mariegillain annefontaine
1897,Chéri,tt1179258,comedy drama romance age difference courtesan mansion marriage prostitute tomburke ibenhjejle gayebrown stephenfrears
1898,Vanity Fair,tt0241025,drama aristocrat english painter painting singer romolagarai rogerlloydpack lilletedubey miranair
1899,1408,tt0450385,fantasy horror book debunking evil hotel paranormal phenomena drewpowell kimthomson alexandrasilber mikaelhåfström
1900,Spaceballs,tt0094012,adventure comedy sci-fi parody planet enclosed within shield sci fi spoof self referential winnebago joanrivers dickvanpatten michaelwinslow melbrooks
1901,The Water Diviner,tt3007512,drama war australian battle battle of gallipoli gallipoli world war one cemyilmaz ryancorr stevebastoni russellcrowe
1902,Ghost,tt0099653,drama fantasy romance thriller death film blanc invisibility love unrequited love demimoore tonygoldwyn philleeds jerryzucker
1903,There's Something About Mary,tt0129387,comedy romance accident curtain call dream girl high school prom sarahsilverman linshaye richardtyson bobbyfarrelly
1904,The Santa Clause,tt0111070,comedy drama family fantasy 1990s christmas christmas eve sleigh surrealism judgereinhold ericlloyd peterboyle johnpasquin
1905,The Rookie,tt0265662,drama family sport baseball coach high school pitching texas dennisquaid jayhernandez angust.jones johnleehancock
1906,The Game Plan,tt0492956,comedy family sport family relationships football movie publicist sports team tween girl dwaynejohnson kyrasedgwick madisonpettis andyfickman
1907,The Bridges of Madison County,tt0112579,drama romance 1960s bridge housewife love photographer clinteastwood merylstreep debramonk clinteastwood
1908,The Animal,tt0255798,comedy sci-fi camera focus on a female butt cartoon on tv forest hairy buttocks seal the animal louislombardi michaelpapajohn colleenhaskell lukegreenfield
1909,The Hundred-Foot Journey,tt2980648,comedy drama chef haute cuisine indian cuisine michelin guide restaurant manishdayal charlottelebon juhichawla lassehallström
1910,The Net,tt0113957,action crime drama mystery thriller chat room computer computer hacker identity identity theft kenhoward jeremynortham raymckinnon irwinwinkler
1911,I Am Sam,tt0277027,drama child custody custody battle disability mentally impaired man single father diannewiest lorettadevine richardschiff jessienelson
1912,Son of God,tt3210686,biography drama history bare chested male bondage crucifixion loincloth reference to god resurrection romadowney amberroserevah darwinshaw christopherspencer
1913,Underworld,tt0320691,action fantasy thriller blood death hybrid vampire werewolf sophiamyles kevingrevioux shanebrolly lenwiseman
1914,Derailed,tt0398017,drama thriller drink hotel police staged rape thief deniso'hare rza xzibit mikaelhåfström
1915,The Informant!,tt1130080,comedy crime drama thriller compulsive liar fbi informant investigation spy mattdamon joelmchale thomasf.wilson stevensoderbergh
1916,Shadowlands,tt0108101,biography drama romance author book england friend oxford anthonyhopkins jamesfrain julianfellowes richardattenborough
1917,Deuce Bigalow: European Gigolo,tt0367652,comedy dolphin gigolo pimp serial killer villain arrested carlosponce eddiegriffin charleskeating mikebigelow
1918,Delivery Man,tt2387559,comedy drama children identity lawsuit lawyer sperm donor jackreynor bobbymoynihan matthewdaddario kenscott
1919,Saving Silverman,tt0239948,comedy crime romance female nudity friend kidnapping love nun amandadetmer neildiamond kylegass dennisdugan
1920,Diary of a Wimpy Kid: Dog Days,tt2023453,comedy family best friend camping country club no opening credits summer vacation zacharygordon rachaelharris karanbrar davidbowers
1921,Summer of Sam,tt0162677,crime drama romance thriller distrust fear murder neighborhood new york city mirasorvino jenniferesposito mikestarr spikelee
1922,Jay and Silent Bob Strike Back,tt0261392,comedy internet jay and silent bob new jersey orangutan police willferrell shannonelizabeth jasonmewes kevinsmith
1923,The Glass House,tt0221218,crime drama mystery thriller car car accident death friend glass chrisnoth brucedern trevormorgan danielsackheim
1924,"Hail, Caesar!",tt0475290,comedy mystery 50s film within a film hollywood illegitimate pregnancy twins scarlettjohansson channingtatum aldenehrenreich ethancoen
