,movie_title,movie_id,tags
2572,Oscar and Lucinda,tt0119843,drama romance australia church glass inheritance wager tomwilkinson richardroxburgh cliverussell gillianarmstrong
2573,The Funeral,tt0116378,crime drama 1930s madness murder new york city violence isabellarossellini vincentgallo gretchenmol abelferrara
2574,Solitary Man,tt1294213,comedy drama romance aging hdtv high definition television love marriage jennafischer davidcostabile richardschiff briankoppelman
2575,Machete,tt0985694,action crime thriller machete mexican mexico priest texas robertdeniro donjohnson cheechmarin ethanmaniquis
2576,Casino Jack,tt1194417,biography comedy crime drama corruption lobbyist murder washington d.c. washington d.c. lobbyist kevinspacey ericschweig christiancampbell georgehickenlooper
2577,The Land Before Time,tt0095489,adventure animation family brontosaurus classical music dinosaur dinosaur feature earthquake judithbarsi gabrieldamon billerwin donbluth
2578,Tae Guk Gi: The Brotherhood of War,tt0386064,action drama war 1950s archeologist korea korean war soldier min-sikchoi binwon dong-gunjang je-kyukang
2579,The Perfect Game,tt0473102,comedy drama family sport baseball movie little league little league baseball mexico three word title cliftoncollinsjr. cheechmarin brucemcgill williamdear
2580,The Exorcist,tt0070047,horror demonic possession exorcism exorcist loss of innocence priest ellenburstyn lindablair leej.cobb williamfriedkin
2581,Jaws,tt0073195,adventure drama thriller beach blockbuster fishing great white shark shark royscheider robertshaw murrayhamilton stevenspielberg
2582,American Pie,tt0163651,comedy 1990s first love milf prom virginity alysonhannigan shannonelizabeth natashalyonne paulweitz
2583,Ernest & Celestine,tt1816518,animation comedy crime drama family bear dentist friendship mouse prejudice mackenziefoy meganmullally lambertwilson stéphaneaubier
2584,The Golden Child,tt0091129,action adventure comedy fantasy mystery boy child chosen one demon detective victorwong randall'tex'cobb charlottelewis michaelritchie
2585,Think Like a Man,tt1621045,comedy romance advice black romance hip hop reading a book sex scene chrisbrown romanymalco reginahall timstory
2586,Barbershop,tt0303714,comedy drama barber barbershop blaxploitation loan shark theft seanpatrickthomas jasongeorge cedrictheentertainer timstory
2587,Star Trek II: The Wrath of Khan,tt0084726,action adventure sci-fi jamming communications planet space station taunt trap leonardnimoy kirstiealley nichellenichols nicholasmeyer
2588,Ace Ventura: Pet Detective,tt0109040,comedy detective dolphin mascot nudity stupidity seanyoung udokier davidmargulies tomshadyac
2589,WarGames,tt0086567,sci-fi thriller computer game high school norad teenager matthewbroderick barrycorbin allysheedy johnbadham
2590,Witness,tt0090329,crime drama romance thriller amish love murder police train harrisonford viggomortensen lukashaas peterweir
2591,Act of Valor,tt1591479,action adventure drama thriller war mission navy seal terrorist torture valor alexveadov jasoncottle rorkedenver mikemccoy
2592,Step Up,tt0462590,crime drama music romance dance dancer school showcase student channingtatum alysonstoner joshhenderson annefletcher
2593,Beavis and Butt-Head Do America,tt0115641,adventure animation comedy crime beavis and butt head fbi score television television set brucewillis demimoore johndoman mikejudge
2594,Jackie Brown,tt0119396,crime thriller arms dealer atf bail money multiple perspectives robertdeniro sidhaig robertforster quentintarantino
2595,Harold & Kumar Escape from Guantanamo Bay,tt0481536,adventure comedy bong escape ex girlfriend guantanamo bay texas danneelackles ericwinter beverlyd'angelo jonhurwitz
2596,Chronicle,tt1706593,drama sci-fi thriller found footage high school subjective camera teen angst troubled teen michaelkelly alexrussell ashleyhinshaw joshtrank
2597,Yentl,tt0086619,drama musical romance love study talmud wedding yeshiva miriammargolyes amyirving stevenhill barbrastreisand
2598,Time Bandits,tt0081633,adventure comedy fantasy sci-fi cult director dwarf robin hood satire treasure shelleyduvall michaelpalin kennybaker terrygilliam
2599,Crossroads,tt0275022,comedy drama audition friendship graduation high school graduation love britneyspears katherineboecher daveallen tamradavis
2600,Project X,tt1636826,comedy crime birthday party high school high school senior millennial generation party daxflame kirbyblissblanton olivercooper nimanourizadeh
2601,One Hour Photo,tt0265459,drama thriller insanity photo lab photo shop photography voyeur robinwilliams garycole connienielsen markromanek
2602,Quarantine,tt1082868,horror sci-fi thriller apartment building found footage television trapped virus andrewfiscella jayhernandez daniaramirez johnerickdowdle
2603,The Eye,tt0406759,horror mystery cellular memory eye eye transplant seeing dead people violinist chloëgracemoretz alessandronivola obbababatundé davidmoreau
2604,Johnson Family Vacation,tt0359517,comedy cross country cross country trip highway travel on the road road movie vanessawilliams shannonelizabeth shadmoss christophererskin
2605,How High,tt0278488,comedy fantasy college drugs harvard pot smoke hectorelizondo fredwillard t.j.thyne jessedylan
2606,The Muppet Christmas Carol,tt0104940,comedy drama family fantasy musical christmas christmas eve miser muppet scrooge stevenmackintosh jerrynelson stevewhitmire brianhenson
2607,Frida,tt0120679,biography drama romance art bisexual marriage pain revolutionary salmahayek rogerrees valeriagolino julietaymor
2608,Katy Perry: Part of Me,tt2215719,documentary music female protagonist reference to britney spears singer song world tour lexiecontursi ashleyashidadixon anthonyburrell dancutforth
2609,The Fault in Our Stars,tt2582846,drama romance cancer falling in love friendship novel teenager shailenewoodley samtrammell natwolff joshboone
2610,Rounders,tt0128442,crime drama breasts cult film loan shark poker reference to christy turlington mattdamon martinlandau gretchenmol johndahl
2611,Top Five,tt2784678,comedy romance bare breasts celebrity in medias res reference to planet of the apes sex talk rosariodawson romanymalco j.b.smoove chrisrock
2612,Stir of Echoes,tt0164181,horror mystery thriller disappearance hearing voices hypnosis post hypnotic suggestion seeing a ghost illeanadouglas kathrynerbe lusiastrus davidkoepp
2613,Philomena,tt2431286,biography drama catholic convent gay love gay relationship irish adoption board stevecoogan marewinningham peterhermann stephenfrears
2614,The Upside of Anger,tt0365885,comedy drama anger baseball drinking radio secretary aliciawitt erikachristensen joanallen mikebinder
2615,Aquamarine,tt0429591,comedy family fantasy romance beach love mermaid storm swimming tamminsursok joanna'jojo'levesque dichenlachman elizabethallenrosenbaum
2616,Paper Towns,tt3622592,drama mystery romance based on novel female neighbor friendship travel trip natwolff caradelevingne megcrosbie jakeschreier
2617,Nebraska,tt1821549,adventure comedy drama aging billings montana lincoln nebraska nebraska pickup truck devinratray brucedern willforte alexanderpayne
2618,Tales from the Crypt: Demon Knight,tt0114608,action fantasy horror thriller blood blood of christ demon key loud sex cchpounder jadapinkettsmith garyfarmer ernestr.dickerson
2619,Max Keeble's Big Move,tt0273799,comedy crime family bully moving principal revenge school noelfisher ambervalletta larrymiller timhill
2620,Young Adult,tt1625346,comedy drama car damage computer printer female band fingernail polish narcissism charlizetheron pattonoswalt collettewolfe jasonreitman
2621,Crank,tt0479884,action crime thriller assassin cult film doctor heart poison jasonstatham edigathegi josepablocantillo markneveldine
2622,Living Out Loud,tt0120722,comedy drama romance brooklyn bridge divorce female protagonist female star appears nude lingerie slip hollyhunter eddiecibrian jenettegoldstein richardlagravenese
2623,Das Boot,tt0082096,adventure drama thriller war duty submarine submarine movie tension u boat jürgenprochnow martinsemmelrogge herbertgrönemeyer wolfgangpetersen
2624,Sorority Boys,tt0279781,comedy college cruise drag female armpit hair sorority heathermatarazzo barrywatson harlandwilliams wallacewolodarsky
2625,About Time,tt2194499,drama fantasy romance boyfriend girlfriend relationship lingerie slip time travel time travel romance wedding tomhughes tomhollander lindsayduncan richardcurtis
2626,House of Flying Daggers,tt0385004,action adventure drama romance flying flying dagger government police secret takeshikaneshiro andylau zhengyongzhang yimouzhang
2627,Arbitrage,tt1764183,drama thriller accidental death dead woman dead woman with eyes open death of mistress manager nateparker curtisscook rege.cathey nicholasjarecki
2628,Project Almanac,tt2436386,sci-fi thriller found footage teenager time machine time travel video footage garyweeks jonnyweston sofiablack-d'elia deanisraelite
2629,Cadillac Records,tt1042877,biography drama music 1950s jazz jazz music sex title directed by female cedrictheentertainer veronikadash tammyblanchard darnellmartin
2630,Screwed,tt0156323,comedy crime chauffeur disorganized crime dog ransom slapstick sarahsilverman davechappelle shermanhemsley scottalexander
2631,Fortress,tt0106950,action crime sci-fi thriller escape future population control prison prisoner christopherlambert kurtwoodsmith cliftoncollinsjr. stuartgordon
2632,For Your Consideration,tt0470765,comedy actor internet make up publicist purim johnmichaelhiggins catherineo'hara edbegleyjr. christopherguest
2633,Celebrity,tt0120533,comedy drama celebrity journalist lesbian kiss strong female character tv producer melaniegriffith aleksapalladino gregmottola woodyallen
2634,Running with Scissors,tt0439289,comedy drama alcoholic fame therapist writer writing jillclayburgh josephcross dagmaradominczyk ryanmurphy
2635,From Justin to Kelly,tt0339034,comedy musical romance bar florida love spring break waitress anikanonirose kellyclarkson briandietzen robertiscove
2636,Girl 6,tt0116414,comedy drama actress neighbor phone sex queens new york city sex addiction michaelimperioli debimazar gretchenmol spikelee
2637,In the Cut,tt0199626,mystery thriller blow job female rear nudity female removes her clothes oral sex three of spades tattoo jenniferjasonleigh nickdamici susangardner janecampion
2638,Two Lovers,tt1103275,drama romance jewish love married man neighbor photograph isabellarossellini vinessashaw samanthaivers jamesgray
2639,Last Orders,tt0253200,drama ashes butcher friend friendship memory bobhoskins raywinstone jjfeild fredschepisi
2640,The Host,tt0468492,comedy drama horror sci-fi daughter han river monster river seoul doonabae kang-hosong ah-sungko joon-hobong
2641,Ravenous,tt0129332,fantasy horror thriller based on true story cannibalism captain mexican american war u.s. frontier jeremydavies jeffreyjones davidarquette antoniabird
2642,Charlie Bartlett,tt0423977,comedy drama romance drugs high school prescription drugs private school student robertdowneyjr. meganpark hopedavis jonpoll
2643,The Great Beauty,tt2358891,drama genitalia male frontal nudity male nudity old age party toniservillo sabrinaferilli serenagrandi paolosorrentino
2644,The Dangerous Lives of Altar Boys,tt0238924,comedy drama book boy catholic comic book friend kieranculkin michaelharding jakerichardson petercare
2645,Stoker,tt1682180,drama thriller death hitchcockian psychopath sociopath vomiting miawasikowska aldenehrenreich harmonykorine chan-wookpark
2646,2046,tt0212712,drama romance sci-fi number in title train woman slaps a man woman slaps man written by director ligong tonychiuwaileung maggiecheung kar-waiwong
2647,Married Life,tt0804505,crime drama romance bachelor best friend divorce poison widow davidrichmond-peck erinboyes timothywebber irasachs
2648,Duma,tt0361715,adventure drama family africa bed boy cheetah south africa eamonnwalker hopedavis campbellscott carrollballard
2649,Ondine,tt1235796,drama mystery romance celtic mythology cottage fisherman irish selkie tonycurran stephenrea alicjabachleda neiljordan
2650,Brother,tt0222851,crime drama thriller gang gangster subjective camera written and directed by cast member yakuza omarepps tatyanaali jamesshigeta takeshikitano
2651,Welcome to Collinwood,tt0271259,comedy crime boxing knockout heist implied sex keys prison michaeljeter isaiahwashington andydavoli anthonyrusso
2652,Critical Care,tt0118901,comedy drama half sister hospital latex gloves medicine nun kyrasedgwick annebancroft albertbrooks sidneylumet
2653,The Life Before Her Eyes,tt0815178,drama mystery thriller best friend nonlinear timeline school shooting self sacrifice shooting evaamurrimartino lynncohen brettcullen vadimperelman
2654,Trade,tt0399095,crime drama thriller friend girl mexico city new jersey sex zackward katedelcastillo alicjabachleda marcokreuzpaintner
2655,Fateless,tt0367082,drama romance war bus death gay slur hatred jewish marcellnagy péterfancsikai bálintpéntek lajoskoltai
2656,Breakfast of Champions,tt0120618,comedy breakfast manitoba science fiction writer suicide writer brucewillis albertfinney omarepps alanrudolph
2657,City of Life and Death,tt1124052,drama history war atrocity battle chinese horseback riding martial arts yeliu yuanyuangao ryukohata chuanlu
2658,5 Days of War,tt1486193,action drama war cameraman epic battle journalist south ossetia street shootout richardcoyle kennethcranham anaimnadze rennyharlin
2659,Heaven Is for Real,tt1929263,biography drama based on true story christ christian near death experience pastor jacobvargas connorcorum robmoran randallwallace
2660,Snatch,tt0208092,comedy crime boxer boxing diamond fight gypsy jasonstatham bradpitt jasonflemyng guyritchie
2661,Pet Sematary,tt0098084,fantasy horror cat cemetery maine secret woods mikohughes fredgwynne denisecrosby marylambert
2662,Gremlins,tt0087363,comedy fantasy horror bright light midnight pet small town water phoebecates harrycareyjr. zachgalligan joedante
2663,Star Wars: Episode IV - A New Hope,tt0076759,action adventure fantasy sci-fi death star empire galactic war princess rebellion harrisonford petercushing kennybaker georgelucas
2664,Dirty Grandpa,tt1860213,comedy female removes her clothes fondling voyeur voyeurism white panties robertdeniro zoeydeutch jasonmantzoukas danmazer
2665,Doctor Zhivago,tt0059113,drama romance war bolshevik poet poetry russia russian revolution juliechristie klauskinski geraldinechaplin davidlean
2666,High School Musical 3: Senior Year,tt0962726,comedy drama family music musical romance basketball curtain call graduation high school high school senior lucasgrabeel mattprokop corbinbleu kennyortega
2667,The Fighter,tt0964517,biography drama sport boxer boxing boxing match crack cocaine lowell massachusetts christianbale jackmcgee melissamcmeekin davido.russell
2668,My Cousin Vinny,tt0104952,comedy crime alabama jail judicial system lawyer trial fredgwynne brucemcgill lanesmith jonathanlynn
2669,If I Stay,tt1355630,drama fantasy music romance car accident coma out of body experience reference to the exploited teenage girl chloëgracemoretz mireilleenos stacykeach r.j.cutler
2670,Major League,tt0097815,comedy sport cleveland indians league manager owner team corbinbernsen tomberenger renerusso davids.ward
2671,Phone Booth,tt0183649,crime thriller phone booth publicist single set production sniper sniper rifle radhamitchell johnenosiii richardt.jones joelschumacher
2672,A Walk to Remember,tt0281358,drama romance community service love punishment school student laurengerman petercoyote pazdelahuerta adamshankman
2673,Dead Man Walking,tt0112818,crime drama death execution nun solitary confinement visit loissmith celiaweston robertprosky timrobbins
2674,Cruel Intentions,tt0139134,drama romance bet revenge seduction virgin wager sarahmichellegellar seanpatrickthomas ericmabius rogerkumble
2675,Saw VI,tt1233227,horror mystery deception flash photography game of death jigsaw pig mask costasmandylor shawneesmith georgenewbern kevingreutert
2676,The Secret Life of Bees,tt0416212,drama beekeeping insect in title racism sister south carolina nateparker aliciakeys jenniferhudson ginaprince-bythewood
2677,Corky Romano,tt0250310,comedy crime fbi mafia mobster undercover veterinarian vincentpastore vinessashaw peterberg robpritts
2678,Raising Cain,tt0105217,crime drama thriller hitchcockian long tracking shot psychologist psychology wig stevenbauer gabriellecarteris gregghenry briandepalma
2679,Invaders from Mars,tt0091276,horror sci-fi alien boy nurse school school nurse louisefletcher budcort williambassett tobehooper
2680,Brooklyn,tt2381111,drama romance 1950s immigrant irish irish accent torn between two worlds juliewalters fionaglascott evabirthistle johncrowley
2681,Out Cold,tt0253798,comedy sport alaska mountain ski resort snowboard snowboarding leemajors jasonlondon thomaslennon brendanmalloy
2682,The Ladies Man,tt0213790,comedy black pantyhose female stockinged legs pantyhose radio tattoo willferrell johnwitherspoon timmeadows reginaldhudlin
2683,Quartet,tt1441951,comedy drama divorced couple opera reference to giuseppe verdi retirement senility lukenewberry sheridansmith paulinecollins dustinhoffman
2684,Tomcats,tt0246989,comedy box office flop critically bashed dominatrix friend money shannonelizabeth jakebusey davidogdenstiers gregorypoirier
2685,Frailty,tt0264616,crime drama thriller demon fbi fbi agent murder religious fanatic matthewmcconaughey powersboothe matto'leary billpaxton
2686,Woman in Gold,tt2404425,biography drama history art jewish justice nazi theft ryanreynolds francesfisher elizabethmcgovern simoncurtis
2687,Kinsey,tt0362269,biography drama professor research sex sexuality student liamneeson oliverplatt dylanbaker billcondon
2688,Army of Darkness,tt0106308,comedy fantasy horror army of the dead battle necronomicon reluctant hero skeleton soldier patriciatallman bridgetfonda embethdavidtz samraimi
2689,Slackers,tt0240900,comedy romance blackmail fall love nerd scam jaimeking geddewatanabe jimrash deweynicks
2690,What's Eating Gilbert Grape,tt0108550,drama romance apostrophe in title face slap four word title grocery store police johnnydepp leonardodicaprio kevintighe lassehallström
2691,The Visual Bible: The Gospel of John,tt0377992,biography drama history 1st century based on the bible miracle religion resurrection henryiancusick alanvansprang scotthandy philipsaville
2692,Vera Drake,tt0383694,crime drama 1950s miscarriage neighbor pregnancy tailor eddiemarsan sallyhawkins imeldastaunton mikeleigh
2693,The Guru,tt0280720,comedy music romance bollywood illegal immigrant live television restaurant waiter michaelmckean dashmihok jimimistry daisyvonscherlermayer
2694,The Perez Family,tt0114113,comedy drama romance immigration love political prisoner reference to john wayne title directed by female anjelicahuston chazzpalminteri vincentgallo miranair
2695,Inside Llewyn Davis,tt2042568,drama music 1960s car hitting an animal folk singer friend singer justintimberlake maxcasella alexkarpovsky ethancoen
2696,O,tt0184791,drama romance thriller basketball basketball player boarding school love shakespeare's othello mekhiphifer andrewkeegan johnheard timblakenelson
2697,Return to the Blue Lagoon,tt0102782,adventure drama romance baby desert island island sequel teenage girl millajovovich waynepygram lisapelikan williama.graham
2698,Copying Beethoven,tt0424908,biography drama music music copyist music student musical composition student symphony phyllidalaw davidkennedy angusbarnett agnieszkaholland
2699,Saw V,tt1132626,horror mystery blood splatter jigsaw nazi serial killer swastika tattoo juliebenz costasmandylor scottpatterson davidhackl
2700,Jindabyne,tt0382765,crime drama mystery thriller camp fishing fishing trip river town johnhoward deborra-leefurness maxcullen raylawrence
2701,Kabhi Alvida Naa Kehna,tt0449999,drama extramarital affair fashion magazine editor marriage new york teacher shahrukhkhan johnabraham preityzinta karanjohar
2702,An Ideal Husband,tt0122541,comedy romance bachelor blackmail character says i love you flirting social satire minniedriver ruperteverett jeremynortham oliverparker
2703,The Last Days on Mars,tt1709143,horror sci-fi thriller alien infection astronaut mars mission zombie romolagarai oliviawilliams tomcullen ruairirobinson
2704,Darkness,tt0273517,horror 9 year old blood gramophone house missing children lenaolin giancarlogiannini francescpagès jaumebalagueró
2705,2001: A Space Odyssey,tt0062622,adventure mystery sci-fi ancient astronaut famous line message from outer space monolith star child keirdullea garylockwood glennbeck stanleykubrick
2706,E.T. the Extra-Terrestrial,tt0083866,family sci-fi bicyclist boy doll star wars reference voice impersonation henrythomas deewallace petercoyote stevenspielberg
2707,In the Land of Women,tt0419843,comedy drama romance actress love michigan neighbor writer kristenstewart elenaanaya dustinmilligan jonkasdan
2708,For Greater Glory: The True Story of Cristiada,tt1566501,drama history war catholic hanging mexico rebellion soldier santiagocabrera eduardoverástegui catalinasandinomoreno deanwright
2709,Good Will Hunting,tt0119217,drama friend genius janitor loss of wife professor robinwilliams mattdamon minniedriver gusvansant
2710,Saw III,tt0489270,horror mystery brutality female full frontal nudity female nudity torture trap costasmandylor shawneesmith leighwhannell darrenlynnbousman
2711,Stripes,tt0083131,action comedy war army boot camp breasts graduation rescue billmurray haroldramis judgereinhold ivanreitman
2712,Bring It On,tt0204946,comedy sport championship cheerleading high school teen comedy teenage romance kirstendunst lindsaysloane clarekramer peytonreed
2713,The Purge: Election Year,tt4094724,action horror sci-fi thriller cathedral minister presidential election reference to george washington ritual sacrifice frankgrillo josephjuliansoria mykeltiwilliamson jamesdemonaco
2714,She's All That,tt0160862,comedy romance bet friend high school prom prom queen paulwalker cleaduvall kieranculkin robertiscove
2715,Saw IV,tt0890870,horror mystery detective fbi rape rapist serial rapist costasmandylor shawneesmith angusmacfadyen darrenlynnbousman
2716,White Noise,tt0375210,drama horror mystery thriller architect grave obsession river voice deborahkaraunger keeganconnortracy mikedopud geoffreysax
2717,Madea's Family Reunion,tt0455612,comedy drama romance cross dressing family reunion madea series reflective sister sister relationship boriskodjoe cicelytyson blairunderwood tylerperry
2718,The Color of Money,tt0090863,drama sport hustler losing pool pool player tournament tomcruise billcobbs maryelizabethmastrantonio martinscorsese
2719,The Mighty Ducks,tt0104868,comedy drama family sport coach hockey team lawyer respect team lanesmith shaunweiss eldenhenson stephenherek
2720,The Grudge,tt0391198,horror mystery thriller american curse japan nurse rage sarahmichellegellar cleaduvall tedraimi takashishimizu
2721,Happy Gilmore,tt0116483,comedy sport golf golf ball golfer grandmother's house tournament adamsandler kevinnealon francesbay dennisdugan
2722,Jeepers Creepers,tt0263488,horror mystery demon gore record player tattoo wings eileenbrennan patriciabelcher jonathanbreck victorsalva
2723,Bill & Ted's Excellent Adventure,tt0096928,adventure comedy music sci-fi failing student high school payphone teenager telephone booth keanureeves georgecarlin alleong stephenherek
2724,Oliver!,tt0063385,drama family musical abuse child orphan orphanage pickpocket oliverreed ronmoody jackwild carolreed
2725,The Best Exotic Marigold Hotel,tt1412386,comedy drama hotel india marigold retiree retirement tomwilkinson penelopewilton celiaimrie johnmadden
2726,Recess: School's Out,tt0265632,animation comedy family mystery sci-fi friend principal summer summer camp summer vacation diedrichbader andrewlawrence dabneycoleman chucksheetz
2727,Mad Max Beyond Thunderdome,tt0089530,action adventure sci-fi thriller arena desert fight mad max post apocalypse tinaturner brucespence angelorossitto georgemiller
2728,The Boy,tt3882082,horror mystery thriller animate doll doll england nanny surprise ending laurencohan rupertevans stephanielemelin williambrentbell
2729,Devil,tt1314655,horror mystery thriller devil elevator hit and run throat slitting trapped in an elevator bojananovakovic bokeemwoodbine geoffreyarend johnerickdowdle
2730,Friday After Next,tt0293815,comedy drama apartment christmas christmas present rent security guard johnwitherspoon mikeepps kattwilliams marcusraboy
2731,Insidious: Chapter 3,tt3195644,fantasy horror thriller demon possession psychic supernatural teenager linshaye hayleykiyoko leighwhannell leighwhannell
2732,The Last Dragon,tt0089461,action comedy drama music cult film kung fu kung fu classic martial arts title spoken by character mikestarr vanity keshiaknightpulliam michaelschultz
2733,The Lawnmower Man,tt0104692,horror sci-fi intelligence science runs amok scientist supernatural power virtual reality jefffahey austino'brien troyevans brettleonard
2734,Nick and Norah's Infinite Playlist,tt0981227,comedy drama music romance band gay gay friend love night arigraynor alexisdziena aaronyoo petersollett
2735,Dogma,tt0120655,adventure comedy drama fantasy abortion abortion clinic angel church clinic mattdamon janeanegarofalo georgecarlin kevinsmith
2736,The Banger Sisters,tt0280460,comedy drama bartender groupie lawyer road trip writer erikachristensen evaamurrimartino sallopez bobdolman
2737,Twilight Zone: The Movie,tt0086491,fantasy horror sci-fi 1940s 1960s bar kick the can remake albertbrooks alleong vicmorrow joedante
