,movie_title,movie_id,tags
0,Avatar,tt0499549,action adventure fantasy sci-fi avatar future marine native paraplegic cchpounder joeldavidmoore wesstudi jamescameron
1,Pirates of the Caribbean: At World's End,tt0449088,action adventure fantasy goddess marriage ceremony marriage proposal pirate singapore johnnydepp orlandobloom jackdavenport goreverbinski
2,Spectre,tt2379713,action adventure thriller bomb espionage sequel spy terrorist christophwaltz rorykinnear stephaniesigman sammendes
3,The Dark Knight Rises,tt1345836,action thriller deception imprisonment lawlessness police officer terrorist plot tomhardy christianbale josephgordon-levitt christophernolan
4,John Carter,tt0401729,action adventure sci-fi alien american civil war male nipple mars princess darylsabara samanthamorton pollywalker andrewstanton
5,Spider-Man 3,tt0413300,action adventure romance sandman spider man symbiote venom villain j.k.simmons jamesfranco kirstendunst samraimi
6,Tangled,tt0398286,adventure animation comedy family fantasy musical romance 17th century based on fairy tale disney flower tower bradgarrett donnamurphy m.c.gainey nathangreno
7,Avengers: Age of Ultron,tt2395427,action adventure sci-fi artificial intelligence based on comic book captain america marvel cinematic universe superhero chrishemsworth robertdowneyjr. scarlettjohansson josswhedon
8,Harry Potter and the Half-Blood Prince,tt0417741,adventure family fantasy mystery blood book love potion professor alanrickman danielradcliffe rupertgrint davidyates
9,Batman v Superman: Dawn of Justice,tt2975590,action adventure sci-fi based on comic book batman sequel to a reboot superhero superman henrycavill laurencohan aland.purwin zacksnyder
10,Superman Returns,tt0348150,action adventure sci-fi crystal epic lex luthor lois lane return to earth kevinspacey marlonbrando franklangella bryansinger
11,Quantum of Solace,tt0830515,action adventure action hero attempted rape bond girl official james bond series revenge giancarlogiannini mathieuamalric rorykinnear marcforster
12,Pirates of the Caribbean: Dead Man's Chest,tt0383574,action adventure fantasy box office hit giant squid heart liar's dice monster johnnydepp orlandobloom jackdavenport goreverbinski
13,The Lone Ranger,tt1210819,action adventure western horse outlaw texas texas ranger train johnnydepp ruthwilson tomwilkinson goreverbinski
14,Man of Steel,tt0770828,action adventure fantasy sci-fi based on comic book british actor playing american character final battle origin of hero reboot henrycavill christophermeloni harrylennix zacksnyder
15,The Chronicles of Narnia: Prince Caspian,tt0499448,action adventure family fantasy brother brother relationship brother sister relationship good versus evil king narnia peterdinklage pierfrancescofavino damiánalcázar andrewadamson
16,The Avengers,tt0848228,action adventure sci-fi alien invasion assassin battle iron man soldier chrishemsworth robertdowneyjr. scarlettjohansson josswhedon
17,Pirates of the Caribbean: On Stranger Tides,tt1298650,action adventure fantasy blackbeard captain pirate revenge soldier johnnydepp samclaflin stephengraham robmarshall
18,Men in Black 3,tt1409024,action adventure comedy family fantasy sci-fi alien criminal m.i.b. maximum security prison prison willsmith michaelstuhlbarg nicolescherzinger barrysonnenfeld
19,The Hobbit: The Battle of the Five Armies,tt2310332,adventure fantasy army elf hobbit middle earth orc aidanturner adambrown jamesnesbitt peterjackson
20,The Amazing Spider-Man,tt0948470,action adventure fantasy lizard outcast spider spider man teenager emmastone andrewgarfield chriszylka marcwebb
21,Robin Hood,tt0955308,action adventure drama history 1190s archer england king of england robin hood markaddy williamhurt scottgrimes ridleyscott
22,The Hobbit: The Desolation of Smaug,tt1170358,adventure fantasy dwarf elf lake town mountain sword and sorcery aidanturner adambrown jamesnesbitt peterjackson
23,The Golden Compass,tt0385752,adventure family fantasy children epic friend girl quest christopherlee evagreen kristinscottthomas chrisweitz
24,King Kong,tt0360717,action adventure drama romance animal name in title ape abducts a woman gorilla island king kong naomiwatts thomaskretschmann evanparke peterjackson
25,Titanic,tt0120338,drama romance artist love ship titanic wet leonardodicaprio katewinslet gloriastuart jamescameron
26,Captain America: Civil War,tt3498820,action adventure sci-fi based on comic book knife marvel cinematic universe returning character killed off superhero robertdowneyjr. scarlettjohansson chrisevans anthonyrusso
27,Battleship,tt1440129,action adventure sci-fi thriller box office flop hawaii naval oahu hawaii ship liamneeson alexanderskarsgård tadanobuasano peterberg
28,Jurassic World,tt0369610,action adventure sci-fi thriller dinosaur disaster film experiment gone wrong jurassic park velociraptor brycedallashoward judygreer omarsy colintrevorrow
29,Skyfall,tt1074638,action adventure thriller brawl childhood home computer cracker intelligence agency terrorist cell albertfinney helenmccrory rorykinnear sammendes
30,Spider-Man 2,tt0316654,action adventure fantasy romance death doctor scientist super villain tentacle j.k.simmons jamesfranco kirstendunst samraimi
31,Iron Man 3,tt1300854,action adventure sci-fi armor explosion human bomb missile attack terrorist robertdowneyjr. jonfavreau doncheadle shaneblack
32,Alice in Wonderland,tt1014759,adventure family fantasy alice in wonderland mistaking reality for dream queen shrinking shrinking potion johnnydepp alanrickman annehathaway timburton
33,X-Men: The Last Stand,tt0376994,action adventure fantasy sci-fi thriller battle mutant outrage walking through a wall x men hughjackman kelseygrammer danielcudmore brettratner
34,Monsters University,tt1453405,adventure animation comedy family fantasy cheating fraternity monster singing in a car university stevebuscemi tylerlabine seanhayes danscanlon
35,Transformers: Revenge of the Fallen,tt1055369,action adventure sci-fi autobot decepticon machine sun symbol glennmorshower kevindunn ramonrodriguez michaelbay
36,Transformers: Age of Extinction,tt2109248,action adventure sci-fi blockbuster bumblebee the character semi truck and trailer texas truck bingbingli sophiamyles kelseygrammer michaelbay
37,Oz the Great and Powerful,tt1623205,adventure family fantasy circus magic magician oz witch timholmes milakunis jamesfranco samraimi
38,The Amazing Spider-Man 2,tt1872181,action adventure fantasy sci-fi costumed hero death of girlfriend masked vigilante returning character killed off teenager emmastone andrewgarfield b.j.novak marcwebb
39,TRON: Legacy,tt1104001,action adventure sci-fi arcade bridge disappearance escape warrior jeffbridges oliviawilde jamesfrain josephkosinski
40,Cars 2,tt1216475,adventure animation comedy family sport best friend car race conspiracy gadget car spy joemantegna thomaskretschmann eddieizzard johnlasseter
41,Green Lantern,tt1133985,action adventure sci-fi autopsy lantern planet ring test pilot ryanreynolds temueramorrison taikawaititi martincampbell
42,Toy Story 3,tt0435761,adventure animation comedy family fantasy college day care escape teddy bear toy tomhanks johnratzenberger donrickles leeunkrich
43,Terminator Salvation,tt0438488,action adventure sci-fi death row future machine rescue skynet christianbale brycedallashoward common mcg
44,Furious 7,tt2820852,action crime thriller car falling off a cliff hospital revenge star died before release terrorist jasonstatham paulwalker vindiesel jameswan
45,World War Z,tt0816711,action adventure horror sci-fi thriller chaos disease infection pandemic zombie petercapaldi bradpitt mireilleenos marcforster
46,X-Men: Days of Future Past,tt1877832,action adventure fantasy sci-fi thriller dystopia super strength supernatural power time paradox time travel jenniferlawrence peterdinklage hughjackman bryansinger
47,Star Trek Into Darkness,tt1408101,action adventure sci-fi admiral captain manhunt mission space benedictcumberbatch brucegreenwood noelclarke j.j.abrams
48,Jack the Giant Slayer,tt1351685,adventure fantasy bean giant king no opening credits princess eddiemarsan ewenbremner ralphbrown bryansinger
49,The Great Gatsby,tt1343092,drama romance ingratitude mansion party title appears in writing tragedy leonardodicaprio elizabethdebicki stevebisley bazluhrmann
50,Prince of Persia: The Sands of Time,tt0473075,action adventure fantasy romance alamut dagger king persia princess jakegyllenhaal richardcoyle reeceritchie mikenewell
51,Pacific Rim,tt1663662,action adventure sci-fi giant monster kaiju pilot portal robot charliehunnam cliftoncollinsjr. larryjoecampbell guillermodeltoro
52,Transformers: Dark of the Moon,tt1399103,action adventure sci-fi autobot decepticon job interview moon spacecraft glennmorshower lesterspeight kevindunn michaelbay
53,Indiana Jones and the Kingdom of the Crystal Skull,tt0367882,action adventure fantasy cult figure femme fatale indiana jones unsubtitled foreign language year 1957 harrisonford raywinstone jimbroadbent stevenspielberg
54,Brave,tt1217209,adventure animation comedy family fantasy archery coming of age female warrior princess rebellious daughter kellymacdonald johnratzenberger juliewalters markandrews
55,Star Trek Beyond,tt2660888,action adventure sci-fi thriller hatred sequel space opera star trek third part sofiaboutella melissaroxburgh lydiawilson justinlin
56,WALL·E,tt0910970,adventure animation family sci-fi earth obesity plant robot soil johnratzenberger fredwillard jeffgarlin andrewstanton
57,Rush Hour 3,tt0293564,action comedy crime thriller ambassador assassination chinese french triad tzima danaivey noémielenoir brettratner
58,2012,tt1190080,action adventure sci-fi ark catastrophe geologist president writer oliverplatt liamjames tommccarthy rolandemmerich
59,A Christmas Carol,tt1067106,animation drama family fantasy charles dickens christmas christmas eve ghost scrooge robinwright colinfirth garyoldman robertzemeckis
60,Jupiter Ascending,tt1617661,action adventure sci-fi box office flop critically bashed planet earth space opera woman in bra and panties channingtatum milakunis eddieredmayne lanawachowski
61,The Legend of Tarzan,tt0918940,action adventure drama romance africa capture jungle male objectification tarzan christophwaltz alexanderskarsgård caspercrump davidyates
62,"The Chronicles of Narnia: The Lion, the Witch and the Wardrobe",tt0363771,adventure family fantasy hide and seek lion magic professor snow jimbroadbent kiranshah shanerangi andrewadamson
63,X-Men: Apocalypse,tt3385516,action adventure sci-fi mutant superhero superhero team x men year 1983 jenniferlawrence michaelfassbender tyesheridan bryansinger
64,The Dark Knight,tt0468569,action crime drama thriller based on comic book dc comics psychopath star died before release urban setting christianbale heathledger morganfreeman christophernolan
65,Up,tt1049413,adventure animation comedy family balloon house promise retirement skeleton johnratzenberger delroylindo jessharnell petedocter
66,Monsters vs. Aliens,tt0892782,action adventure animation comedy family sci-fi alien alien invasion alien space craft giant giantess amypoehler rainnwilson stephencolbert robletterman
67,Iron Man,tt0371746,action adventure sci-fi afghanistan billionaire inventor playboy u.s. air force robertdowneyjr. jeffbridges jonfavreau jonfavreau
68,Hugo,tt0970179,adventure drama family mystery automaton mechanical railway station steampunk train chloëgracemoretz christopherlee raywinstone martinscorsese
69,Wild Wild West,tt0120891,action comedy sci-fi western buddy movie general inventor steampunk utah willsmith salmahayek bailing barrysonnenfeld
70,The Mummy: Tomb of the Dragon Emperor,tt0859163,action adventure fantasy horror thriller army china emperor mummy shangri la jetli brendanfraser russellwong robcohen
71,Suicide Squad,tt1386697,action adventure comedy sci-fi based on comic book critically bashed father daughter relationship reference to superman super villain willsmith robinatkindownes ikebarinholtz davidayer
72,Evan Almighty,tt0413099,comedy family fantasy ark change congressman depiction of god flood jimmybennett morganfreeman stevecarell tomshadyac
73,Edge of Tomorrow,tt1631867,action adventure sci-fi alien combat dying repeatedly end of the world time loop tomcruise larapulver noahtaylor dougliman
74,Waterworld,tt0114898,action adventure sci-fi thriller future sail sea smoker water jeannetripplehorn rickaviles zakesmokae kevinreynolds
75,G.I. Joe: The Rise of Cobra,tt1046173,action adventure sci-fi thriller cobra gi joe snake train warhead josephgordon-levitt dennisquaid leohoward stephensommers
76,Inside Out,tt2096673,adventure animation comedy drama family fantasy anger joy memory running away sadness amypoehler mindykaling phyllissmith petedocter
77,The Jungle Book,tt3040964,adventure drama family fantasy fire jungle remake tiger wolf scarlettjohansson billmurray garryshandling jonfavreau
78,Iron Man 2,tt1228705,action adventure sci-fi hammer military monaco revenge tony stark robertdowneyjr. scarlettjohansson jonfavreau jonfavreau
79,Snow White and the Huntsman,tt1735898,action adventure drama fantasy evil queen fairy tale magic queen snow white chrishemsworth kristenstewart samclaflin rupertsanders
80,Maleficent,tt1587310,action adventure family fantasy romance curse dark fantasy fairy king kingdom angelinajoliepitt sharltocopley samriley robertstromberg
81,Dawn of the Planet of the Apes,tt2103281,action adventure drama sci-fi ape dam leader post apocalypse sequel garyoldman judygreer kodismit-mcphee mattreeves
82,47 Ronin,tt1335975,action adventure drama fantasy box office flop ronin samurai shogun tournament keanureeves cary-hiroyukitagawa jinakanishi carlrinsch
83,Captain America: The Winter Soldier,tt1843866,action adventure sci-fi conspiracy heroism megalomaniac super soldier world domination scarlettjohansson chrisevans hayleyatwell anthonyrusso
84,Shrek Forever After,tt0892791,adventure animation comedy family fantasy alternate world fairy tale parody female warrior ogre true love jonhamm kathygriffin marykayplace mikemitchell
85,Tomorrowland,tt1964418,action adventure family mystery sci-fi boy genius futuristic city inventor teenage girl time travel judygreer chrisbauer thomasrobinson bradbird
86,Big Hero 6,tt2245084,action adventure animation comedy drama family sci-fi high tech martial arts masked man robot superhero damonwayansjr. danielhenney abrahambenrubi donhall
87,Wreck-It Ralph,tt1772341,adventure animation comedy family sci-fi arcade candy glitch king medal jackmcbrayer sarahsilverman joelotruglio richmoore
88,The Polar Express,tt0338348,adventure animation family fantasy boy christmas christmas eve north pole train tomhanks eddiedeezen peterscolari robertzemeckis
89,Independence Day: Resurgence,tt1628841,action adventure sci-fi alien battle defense independence day mothership vivicaa.fox selaward juddhirsch rolandemmerich
90,How to Train Your Dragon,tt0892769,adventure animation family fantasy dragon island training viking village gerardbutler americaferrera craigferguson deandeblois
91,Terminator 3: Rise of the Machines,tt0181852,action sci-fi drifter exploding truck future machine skynet nickstahl m.c.gainey carolynhennesy jonathanmostow
92,Guardians of the Galaxy,tt2015381,action adventure sci-fi bounty hunter outer space raccoon talking animal tree bradleycooper vindiesel djimonhounsou jamesgunn
93,Interstellar,tt0816692,adventure drama sci-fi black hole father daughter relationship saving the world space travel wormhole matthewmcconaughey annehathaway mackenziefoy christophernolan
94,Inception,tt1375666,action adventure sci-fi thriller ambiguous ending corporate espionage dream subconscious thief leonardodicaprio tomhardy josephgordon-levitt christophernolan
95,The Hobbit: An Unexpected Journey,tt0903624,adventure fantasy dragon dwarf hobbit orc wizard aidanturner adambrown jamesnesbitt peterjackson
96,The Fast and the Furious,tt0232500,action crime thriller eighteen wheeler illegal street racing truck trucker undercover cop paulwalker vindiesel jordanabrewster robcohen
97,The Curious Case of Benjamin Button,tt0421715,drama fantasy romance deformed baby diary lingerie slip older man younger woman relationship premature aging bradpitt jasonflemyng juliaormond davidfincher
98,X-Men: First Class,tt1270798,action adventure sci-fi cia cia agent mutant nuclear war professor jenniferlawrence michaelfassbender oliverplatt matthewvaughn
99,The Hunger Games: Mockingjay - Part 2,tt1951266,adventure sci-fi death of sister dystopia execution rebellion revolution jenniferlawrence philipseymourhoffman joshhutcherson francislawrence
100,The Sorcerer's Apprentice,tt0963966,action adventure family fantasy chosen one enchanted object love spell training nicolascage omarbensonmiller robertcapron jonturteltaub
101,Poseidon,tt0409182,action adventure drama thriller cruise escape ocean passenger water jimmybennett mikevogel andrebraugher wolfgangpetersen
102,Alice Through the Looking Glass,tt2567026,adventure family fantasy clock dark fantasy mad hatter queen sequel johnnydepp alanrickman annehathaway jamesbobin
103,Shrek the Third,tt0413267,adventure animation comedy family fantasy disney spoof fairy tale prince princess tough guy justintimberlake ericidle ruperteverett chrismiller
104,Warcraft,tt0803096,action adventure fantasy based on video game fictional language fictional war orc sword and sorcery dominiccooper callumrennie ruthnegga duncanjones
105,Terminator Genisys,tt1340138,action adventure sci-fi alternate timeline cyborg future robot time machine j.k.simmons emiliaclarke mattsmith alantaylor
106,The Chronicles of Narnia: The Voyage of the Dawn Treader,tt0980970,adventure family fantasy dragon king mouse quest warrior brucespence shanerangi laurabrent michaelapted
107,Pearl Harbor,tt0213149,action drama history romance war air raid black smoke japanese military japanese navy sunday jennifergarner jaimeking mako michaelbay
108,Transformers,tt0418279,action adventure sci-fi alien contact autobot decepticon robot vs. robot teenage hero zackward michaelo'neill kevindunn michaelbay
109,Alexander,tt0346491,action adventure biography drama history romance war ancient greece conquest greek greek myth king anthonyhopkins angelinajoliepitt brianblessed oliverstone
110,Harry Potter and the Order of the Phoenix,tt0373889,adventure family fantasy mystery battle magic school teacher wizard robertpattinson danielradcliffe fionashaw davidyates
111,Harry Potter and the Goblet of Fire,tt0330373,adventure family fantasy mystery fire goblet magic tournament wizard robertpattinson danielradcliffe rupertgrint mikenewell
112,Hancock,tt0448157,action drama bully comeuppance destruction prison superhero tough girl willsmith charlizetheron eddiemarsan peterberg
113,I Am Legend,tt0480249,drama horror sci-fi new york city pandemic post apocalypse survivalist virus willsmith alicebraga willowsmith francislawrence
114,Charlie and the Chocolate Factory,tt0367594,adventure comedy family fantasy chocolate diminution miniaturization physical flexability ticket johnnydepp christopherlee davidkelly timburton
115,Ratatouille,tt0382932,animation comedy family fantasy chef food french rat restaurant janeanegarofalo johnratzenberger briandennehy bradbird
116,Batman Begins,tt0372784,action adventure armored car gangster gotham mixed martial arts social decay christianbale liamneeson morganfreeman christophernolan
117,Madagascar: Escape 2 Africa,tt0479952,action adventure animation comedy family africa madagascar new york city sequel zoo berniemac jadapinkettsmith cedrictheentertainer ericdarnell
118,Night at the Museum: Battle of the Smithsonian,tt1078912,adventure comedy family fantasy hdtv motorcycle museum security guard tyrannosaurus rex robinwilliams ramimalek stevecoogan shawnlevy
119,X-Men Origins: Wolverine,tt0458525,action adventure fantasy sci-fi thriller army civil war claw fight commando wolverine the character hughjackman ryanreynolds dominicmonaghan gavinhood
120,The Matrix Revolutions,tt0242653,action sci-fi battle epic fight future machine essiedavis collinchou nonagaye lanawachowski
121,Frozen,tt2294629,adventure animation comedy family fantasy musical magic sister love sister sister relationship snow snowman joshgad mauricelamarche livvystubenrauch chrisbuck
122,The Matrix Reloaded,tt0234215,action sci-fi car motorcycle chase one against many oracle prophecy stylized violence stevebastoni danielbernhardt helmutbakaitis lanawachowski
123,Thor: The Dark World,tt1981115,action adventure fantasy arrest portal thor warrior weapon chrishemsworth natalieportman anthonyhopkins alantaylor
124,Mad Max: Fury Road,tt1392190,action adventure sci-fi thriller australia desert escape on the run post apocalypse tomhardy charlizetheron zoëkravitz georgemiller
125,Angels & Demons,tt0808151,mystery thriller conclave illuminati murder reference to bernini reference to raphael tomhanks ayeletzurer arminmueller-stahl ronhoward
126,Thor,tt0800369,action adventure fantasy battle marvel cinematic universe scientist thor throne chrishemsworth natalieportman anthonyhopkins kennethbranagh
127,Bolt,tt0397892,adventure animation comedy drama family cat dog hamster new york city superpower chloëgracemoretz diedrichbader jameslipton byronhoward
128,G-Force,tt0436339,action adventure animation comedy family fantasy sci-fi fbi director guinea pig household appliance secret agent talking mouse kelligarner pipermackenzieharris niecynash hoytyeatman
129,Wrath of the Titans,tt1646987,action adventure fantasy ares hades titan underworld zeus liamneeson edgarramírez lilyjames jonathanliebesman
130,Dark Shadows,tt1077368,comedy fantasy horror camera shot of feet cartoon on tv female stockinged feet female stockinged soles foot closeup johnnydepp chloëgracemoretz christopherlee timburton
131,Mission: Impossible - Rogue Nation,tt2381249,action adventure thriller capture computer hacker mission rogue agent spy tomcruise jeremyrenner seanharris christophermcquarrie
132,The Wolfman,tt0780653,drama fantasy horror thriller asylum death full moon transformation werewolf anthonyhopkins simonmerrells artmalik joejohnston
133,Bee Movie,tt0389790,adventure animation comedy family bee dream sequence egg scatological humor squashed bug matthewbroderick oprahwinfrey riptorn stevehickner
134,Kung Fu Panda 2,tt1302011,action adventure animation comedy family china kung fu panda peacock tigress angelinajoliepitt garyoldman mikebell jenniferyuhnelson
135,The Last Airbender,tt0938283,action adventure family fantasy avatar fire kingdom tribe water seychellegabriel noahringer aasifmandvi m.nightshyamalan
136,Mission: Impossible III,tt0317919,action adventure thriller arms dealer fictional government agency mission rescue vatican philipseymourhoffman tomcruise eddiemarsan j.j.abrams
137,White House Down,tt2334879,action drama thriller black u.s. president president secret service tour white house channingtatum jakeweber mattcraven rolandemmerich
138,Mars Needs Moms,tt1305591,action adventure animation comedy family sci-fi boy martian rescue robot sexism elisabethharnois danfogler tomeverettscott simonwells
139,Flushed Away,tt0424095,adventure animation comedy family boat frog rat sewer toad hughjackman katewinslet davidsuchet davidbowers
140,Pan,tt3332064,adventure family fantasy 1940s child hero fantasy world orphan reference to peter pan hughjackman caradelevingne nonsoanozie joewright
141,Mr. Peabody & Sherman,tt0864835,adventure animation comedy family sci-fi dog father son relationship inventor talking dog time travel tyburrell zachcallison karanbrar robminkoff
142,Troy,tt0332452,adventure greek mythology prince trojan troy bradpitt orlandobloom julianglover wolfgangpetersen
143,Madagascar 3: Europe's Most Wanted,tt1277953,adventure animation comedy family animal circus island name in title lemur penguin jadapinkettsmith martinshort cedrictheentertainer ericdarnell
144,Die Another Day,tt0246460,action adventure thriller catfight clinic colonel diamond patricide tobystephens colinsalmon rickyune leetamahori
145,Ghostbusters,tt1289401,action comedy fantasy sci-fi ghost ghostbuster ghostbusters male objectification reboot edbegleyjr. katemckinnon zachwoods paulfeig
146,Armageddon,tt0120591,action adventure sci-fi thriller asteroid astronaut bomb meteorite outer space brucewillis stevebuscemi willpatton michaelbay
147,Men in Black II,tt0120912,action adventure comedy family fantasy mystery sci-fi alien lingerie lingerie model m.i.b. pug willsmith rosariodawson riptorn barrysonnenfeld
148,Beowulf,tt0442933,action adventure animation fantasy creature demon king reward warrior robinwright anthonyhopkins sebastianroché robertzemeckis
149,Kung Fu Panda 3,tt2267968,action adventure animation comedy family china kung fu panda pig village j.k.simmons angelinajoliepitt wayneknight alessandrocarloni
150,Mission: Impossible - Ghost Protocol,tt1229238,action adventure thriller dubai kremlin race against time russian terrorist tomcruise jeremyrenner michaelnyqvist bradbird
151,Rise of the Guardians,tt1446192,adventure animation family fantasy belief box office hit children new york city tooth hughjackman kamilmcfadden khamanigriffin peterramsey
152,Fun with Dick and Jane,tt0369441,comedy crime animal abuse ceo heist suburb unemployment johnmichaelhiggins richardburgi davidherman deanparisot
153,The Last Samurai,tt0325710,action drama history war captain emperor honor japan samurai tomcruise tonygoldwyn chadlindberg edwardzwick
154,Exodus: Gods and Kings,tt1528100,action adventure drama egypt exodus moses pharaoh plague christianbale maríavalverde benmendelsohn ridleyscott
